{
  "type": "answer.completed",
  "event_id": "example-answer-1",
  "session_id": "example-session-1",
  "conversation_revision": 1,
  "created_at": 2.1,
  "payload": {
    "protocol_version": 2,
    "question": "Redis 为什么这么快？",
    "answer": "Redis 快主要因为内存访问、事件驱动和高效数据结构。",
    "code": null,
    "source": "VOICE"
  }
}
